{
  "schema_version": "1.0",
  "query": "Verify the identity, citation count, update status and open-access availability of the paper cited as 10.1177/1758835920922055.",
  "identifiers": {
    "doi": "10.1177/1758835920922055",
    "arxiv_id": null,
    "openalex_id": "W2123456789",
    "pmid": null
  },
  "sources": [
    {
      "source": "OpenAlex",
      "queried_at": "2026-09-16T12:00:00Z",
      "status": "ok",
      "coverage": "identity, citation count, retraction flag",
      "raw_identifier": "https://api.openalex.org/works/https://doi.org/10.1177/1758835920922055"
    },
    {
      "source": "Crossref",
      "queried_at": "2026-09-16T12:00:05Z",
      "status": "ok",
      "coverage": "update-to retraction lookup",
      "raw_identifier": null
    },
    {
      "source": "Unpaywall",
      "queried_at": "2026-09-16T12:00:10Z",
      "status": "skipped",
      "coverage": "open-access location",
      "raw_identifier": null
    }
  ],
  "claims": [
    {
      "claim": "The DOI resolves to a work whose title concerns deep learning in oncology.",
      "evidence_type": "metadata",
      "source": "OpenAlex",
      "locator": "title",
      "support_status": "supported"
    },
    {
      "claim": "The work is not retracted as of the query date.",
      "evidence_type": "update_signal",
      "source": "Crossref",
      "locator": "update-to",
      "support_status": "supported"
    }
  ],
  "conflicts": [],
  "failures": [],
  "artifacts": [],
  "generated_at": "2026-09-16T12:00:15Z"
}
